start_time,end_time,text_content
0.0,6.32,"Hello, good evening. Welcome to my super fancy desk that I definitely intentionally"
6.32,15.84,"made it like this for the purpose of this video. I just wanted to show you guys,"
15.84,22.56,this is the Gomi Candies I got from the seventh market. It's absolutely yummy. I
22.56,29.88,love it. And actually I'm a huge audio file. So I'm jumping in between topics
29.88,40.12,"really quick. I have ADHD so bear with me. Anyway, this is the SM5, SM5 headphones"
40.12,49.239999999999995,"from Sony. They're the absolute best headphones I've ever had. Yeah, as a musician"
49.239999999999995,56.0,I use them to analyze music and the AirPods Pro 3s are great as well.
